claim_area,allowed_claim,forbidden_overclaim,required_evidence,current_artifact,review_status
direct_reply_network,A source message can be linked to a target message by header evidence or documented inference.,"A reply edge proves influence, agreement, mentorship, or scholarly dependence.","`reply_edges.csv` confidence, source URL, target URL, and spot-checks for interpreted examples.",data/processed/reply_edges.csv; data/processed/named_reply_network_summary.csv,active_guardrail
co_participation_network,Two normalized author labels appear in the same public thread.,"Co-participation proves collaboration, friendship, institutional school, or shared views.",`network_edges.csv` or `named_coparticipation_network_summary.csv` plus thread context.,data/processed/network_edges.csv; data/processed/named_coparticipation_network_summary.csv,active_guardrail
message_volume,The archive contains a counted number of messages or threads matching the parser output.,"High message count means importance, expertise, centrality, or field dominance.","`messages_clean.csv`, `threads.csv`, and validation notes about archive coverage.",data/processed/messages_clean.csv; reports/validation.md,active_guardrail
archive_representativeness,The atlas describes visible public INDOLOGY-L archive activity.,"The archive represents all Indology, all Sanskrit studies, or all scholarly communication in the field.",Explicit source scope and caveats in report/dashboard/data dictionary.,data_dictionary.md; reports/research_report.md,active_guardrail
author_normalization,Raw author strings are grouped conservatively for metadata analysis and marked with confidence/evidence.,Normalized labels are authoritative identities or complete biographical records.,"`author_aliases.csv`, `authors_needing_review.csv`, and manual review for public claims.",data/processed/author_aliases.csv; data/processed/authors_needing_review.csv,active_guardrail
case_study_candidates,A thread was selected automatically as a candidate because it matches recorded evidence fields.,Generated candidates are curated examples or definitive major debates before human review.,"`case_study_candidates.csv`, `case_review_queue.csv`, and reviewed `curated_case_studies.csv` rows.",data/processed/case_study_candidates.csv; data/processed/curated_case_studies.csv,active_guardrail
renou_subject_layer,A message or thread subject clearly matches a Renou state/register rule adapted from RENOU.md.,"A blank Renou field proves irrelevance, or a subject match is equivalent to dictionary headword/sense tagging.","`renou_subject_rules.csv`, matched term, confidence, archive URL, and thread context for interpreted examples.",data/processed/renou_messages.csv; data/processed/renou_message_matches.csv; data/curation/renou_subject_rules.csv,active_guardrail
